{
  "id": "ipi-na-base-icms",
  "descricao": "Venda interestadual SP->RJ, destinatario nao contribuinte (uso/consumo), IPI compoe a base do ICMS.",
  "entrada": {
    "ufOrigem": "SP",
    "ufDestino": "RJ",
    "destinatarioContribuinte": false,
    "regimeEmitente": "normal",
    "item": {
      "valorProduto": "1000.00",
      "quantidade": "1",
      "frete": "0.00",
      "seguro": "0.00",
      "desconto": "0.00",
      "outras": "0.00",
      "ipi": { "aliquota": "10.00", "cst": "50", "incluirNaBaseIcms": true },
      "icms": { "cst": "00", "aliquotaInterna": "20.00", "aliquotaInterestadual": "12.00" },
      "pisCofins": { "regime": "cumulativo", "cstPis": "01", "cstCofins": "01", "aliquotaPis": "0.65", "aliquotaCofins": "3.00" }
    }
  },
  "esperado": {
    "icms": { "bc": "1100.00", "aliquota": "12.00", "valor": "132.00" },
    "ipi": { "bc": "1000.00", "aliquota": "10.00", "valor": "100.00" },
    "pis": { "bc": "1000.00", "aliquota": "0.65", "valor": "6.50" },
    "cofins": { "bc": "1000.00", "aliquota": "3.00", "valor": "30.00" },
    "difal": { "valorOrigem": "0.00", "valorDestino": "88.00", "fcp": "0.00" },
    "totalTributos": "356.50"
  }
}
