{
  "id": "cst-60-st-retido",
  "descricao": "Venda interna SP->SP, CST 60 (ICMS cobrado anteriormente por ST): ICMS proprio e ICMS-ST nao devidos nesta operacao.",
  "entrada": {
    "ufOrigem": "SP",
    "ufDestino": "SP",
    "destinatarioContribuinte": true,
    "regimeEmitente": "normal",
    "item": {
      "valorProduto": "1000.00",
      "quantidade": "1",
      "frete": "0.00",
      "seguro": "0.00",
      "desconto": "0.00",
      "outras": "0.00",
      "ipi": { "aliquota": "0.00", "cst": "53", "incluirNaBaseIcms": false },
      "icms": { "cst": "60", "aliquotaInterna": "18.00", "aliquotaInterestadual": "18.00", "mva": "40.00" },
      "pisCofins": { "regime": "cumulativo", "cstPis": "01", "cstCofins": "01", "aliquotaPis": "0.65", "aliquotaCofins": "3.00" }
    }
  },
  "esperado": {
    "icms": { "bc": "1000.00", "aliquota": "18.00", "valor": "0.00" },
    "ipi": { "bc": "1000.00", "aliquota": "0.00", "valor": "0.00" },
    "pis": { "bc": "1000.00", "aliquota": "0.65", "valor": "6.50" },
    "cofins": { "bc": "1000.00", "aliquota": "3.00", "valor": "30.00" },
    "icmsSt": { "bc": "1400.00", "aliquota": "18.00", "valor": "0.00", "mvaAplicada": "40.00" },
    "totalTributos": "36.50"
  }
}
